ID,BPM,KEY,PART,TITLE,ARTIST,ORIGIN,SEASON,YEAR,TYPE,NOTES
000001,"81.5, 81.5, 81.5, 81.5","D Major, A Major, A Major, D Major","Intro, Verse, Prechorus, Chorus",CHA-LA HEAD CHA-LA,Hironobu Kageyama,Dragon Ball Z,,1989,Anime,
000002,71,F Major,,Kimi ga Suki da to Sake Bitai,Baad,Slam Dunk,,1993,Anime,
000003,84.056,E Major,,D-TecnoLife,UVERworld,Bleach,,2005,Anime,
000004,71,G Major,,Red fraction,MELL,Black Lagoon,,2006,Anime,
000005,83,D Major,,Sakura Kiss,Chieko Kawabe,Ouran High School Host Club,,2006,Anime,
000006,82,A# Major,,PAPERMOON,Tommy heavenly6,Soul Eater,,2008,Anime,
000007,"75, 75","C Major, D# Major","Verse, Chorus",Monochrome Kiss,SID,Black Butler,,2008,Anime,
000008,72.5,E Major,,Special days,"Hitomi Nabatame, Yuuko Gotou, Ayahi Takagaki",Special A,,2008,Anime,
000009,76,A Major,,Blue Bird,Ikimono-gakari,Naruto Shippuden,,2008,Anime,
000010,80,F Major,,Pre-Parade,"Rie Kugimiya, Yui Horie, Eri Kitamura",Toradora!,,2008,Anime,
000011,85,E Major,,Cagayake Girls,Houkago Tea Time,K-On!,,2009,Anime,
000012,70,E Major,,Vanilla Salt,Yui Horie,Toradora,,2009,Anime,
000013,"78.07, 78.07, 78.07","C Major, C Major, D Major","Verse, Chorus, Last Chorus",Hologram,NICO Touches the Walls,Fullmetal Alchemist: Brotherhood,,2009,Anime,
000014,"72.5, 72.5, 72.5, 72.5","D Major, D Major, E Major, E Major","Verse, Prechorus, Chorus, Bridge","My Soul, Your Beats",Lia,Angel Beats,,2010,Anime,
000015,70,G Major,,again,yui,Fullmetal Alchemist: Brotherhood,,2010,Anime,
000016,75.5,G Major,,Uragirinoyuuyake,Theatre Brook,Durarara!!,,2010,Anime,
000017,"85, 85, 85, 130","A Major, C Major, A Major, A Major","Verse 1, Prechorus, Chorus, Verse 2",God only knows,Oratorio The World God Only Knows (ELISA),The World God Only Knows,,2010,Anime,
000018,86.5,A Major,,Snow Halation,μ's,Love Live! School Idol Project,,2010,Anime,
000019,85,E Major,,Balance KISS,"Ayana Taketatsu, Yuiko Tatsumi",Kiss X Sis,,2010,Anime,
000020,75,E Major,,Bouken Desho Desho?,Aya Hirano,The Disappearance of Haruhi Suzumiya,,2010,Anime,
000021,76.5,E Major,,Loop-the-Loop,KOTOKO,Motto To Love-Ru,,2010,Anime,
000022,84,C Major,,My Dearest,supercell,Guilty Crown,,2011,Anime,
000023,"76, 76, 76","G Major, G Major, A Major","Verse, Prechorus, Chorus",oath sign,LiSA,Fate/Zero,,2011,Anime,
000024,"80, 80, 80, 80","G# Major, C# Major, A# Major, D Major","Intro, Verse, Chorus, Bridge",departure!,Masatoshi Ono,Hunter x Hunter (2011),,2011,Anime,
000025,"84, 84, 84, 84","D# Major, F Major, D# Major, D# Major","Intro, Verse, Prechorus, Chorus",Be Starters!,Eri Kitamura,Mayo Chiki!,,2011,Anime,
000026,"86, 86","D Major, B Major","Verse, Chorus",The Everlasting Guilty,EGOIST,Guilty Crown,,2011,Anime,
000027,"76, 76, 76","E Major, E Major, F Major","Verse, Chorus, Last Chorus",Nakimushi.,Miku Sawai,You and Me.,,2011,Anime,
000028,77,A Major,,Dream of Life,Shohei Itou,Bakuman.: Season 2,,2011,Anime,
000029,85,D Major,,Kimi + Nazo + Watashi de JUMP!!,Larval Stage Planning,Baka & Test: Summon the Beasts,,2011,Anime,
000030,72,D Major,,Departures (Anata ni Okuru Ai no Uta),EGOIST,Guilty Crown,,2011,Anime,
000031,"80.5, 80.5","F Major, C Major","Verse, Chorus",Hacking To The Gate,Kanako Itou,Steins;Gate,,2011,Anime,
000032,"77, 77","E Major, F# Major","Verse, Chorus",Fly Away,Togashi Misuzu,Maken-ki!,,2011,Anime,
000033,83,A# Major,,Destin Histoire,yoshiki*lisa,Gosick,,2011,Anime,
000034,"77, 77","D Major, E Major","Verse, Chorus",STRAIGHT JET,Minami Kuribayashi,Infinite Stratos,,2011,Anime,
000035,80,A Major,,DAYS of DASH,Konomi Suzuki,The Pet Girl of Sakurasou,,2012,Anime,
000036,"83.5, 83.5, 83.5, 83.5, 83.5","G# Major, F Major, G# Major, G# Major, A Major","Intro, Verse, Prechorus, Chorus, Bridge",Reason why XXX,Sasaki Sayaka,"So, I Can't Play H!",,2012,Anime,
000037,79.5,D# Major,,Platinum 17,yozuca*,"So, I Can't Play H!",,2012,Anime,
000038,73,D Major,,Kamisama Hajime,Hanae,Kamisama Kiss,,2012,Anime,
000039,75.5,E Major,,Little Busters,Rita,Little Busters!,,2012,Anime,
000040,80,A# Major,,abnormalize,Ling Tosite Sigure,Psycho-Pass,,2012,Anime,
000041,"80, 80","C Major, D# Major","Verse, Chorus",Nippon Egao Hyakk,Momoiro Clover Z,Joshiraku,,2012,Anime,
000042,"74, 74","E Major, G Major","Verse, Chorus",Burst the Gravity,ALTIMA ,Accel World,,2012,Anime,
000043,83,G# Major,,Above your hand,Annabel,Sankarea,,2012,Anime,
000044,"80, 80, 80","D Major, D Major, D# Major","Verse, Chorus, Bridge",Paradigm,Eufonius,Kokoro Connect,,2012,Anime,
000045,73,A# Major,,Sono Chi no Sadame,Hiroaki TOMMY Tominaga,JoJo's Bizarre Adventure (2012),,2012,Anime,
000046,72.5,D# Major,,Kyoumu Densen,ALI PROJECT,Another,,2012,Anime,
000047,81,D# Major,,Yumesekai,Haruka Tomatsu,Sword Art Online,,2012,Anime,
000048,82.5,F Major,,Yukitoki,Nagi Yanagi,My Teen Romantic Comedy SNAFU,,2013,Anime,
000049,70.5,F Major,,Golden Time,Yui Horie,Golden Time,,2013,Anime,
000050,75,D Major,,The Other self,GRANRODEO,Kuroko no Basket,,2013,Anime,
000051,82.5,G Major,,Girlish Lover,Mizukara wo Enshutsu Suru Otome no Kai,Oreshura,,2013,Anime,
000052,75,F# Major,,May I Help You?,"Ai Kayano, Mai Nakahara, Aki Toyosaki",Servant x Service,,2013,Anime,
000053,"85.5, 85.5, 85.5, 85.5","C Major, D Major, E Major, C Major","Verse A, Verse B, Prechorus, Chorus",Dramatic Market Ride,Aya Suzaki,Tamako Market,,2013,Anime,
000054,85,A Major,,"Baby Sweet, Berry Sweet",Yui Ogura,"The ""Hentai"" Prince and the Stony Cat.",,2013,Anime,
000055,82,F Major,,Mukaikaze,YOHKO,Maoyuu Maou Yuusha,,2013,Anime,
000056,85,A Major,,Daisy,STEREO DIVE FOUNDATION,Beyond the Boundary,,2013,Anime,
000057,83,A Major,,Kimi ga Emu Yuugure,Yoshino Nanjo,Tokyo Ravens,,2014,Anime,
000058,"77.5, 77.5, 77.5, 77.5","C Major, D# Major, C Major, C Major","Intro, Verse, Prechorus, Chorus",Rakuen no Tsubasa,Maon Kurosaki,The Fruit of Grisaia,,2014,Anime,
000059,84,D Major,,Niji no Oto,Eir Aoi,Sword Art Online: Extra Edition,,2014,Anime,
000060,"84, 84","C# Major, D# Major","Verse, Chorus",I swear,Sweet ARMS,Date A Live II,,2014,Anime,
000061,86,G Major,,Orange,7!!,Your Lie in April,,2014,Anime,
000062,82.5,G# Major,,LOVE GOOD TIME,SpecialThanks,Wolf Girl and Black Prince,,2014,Anime,
000063,77,A Major,,KOI NO UTA,Keiji Fujiwara,Tamako Love Story,,2014,Anime,
000064,71,D# Major,,"Kyouran, Hey Kids!!",THE ORAL CIGARETTES,Noragami Aragoto,,2014,Anime,
000065,70,G# Major,,Ah Yeah!,Sukima Switch,Haikyuu!! Season 2,,2014,Anime,
000066,84,C Major,,Rashisa,SUPER BEAVER,Rashisa,,2014,Anime,
000067,85,G Major,,Tomadoi Recipe,Mikakuning!,Engaged to the Unidentified,,2014,Anime,
000068,85.5,C Major,,IGNITE,Eir Aoi,Sword Art Online II,,2014,Anime,
000069,87,A Major,,Q&A,"Marina Inoue, Saeko Zougou",Date A Live II,,2014,Anime,
000070,80,A Major,,Hikaru Nara,Goose house,Your Lie in April,,2014,Anime,
000071,"73.5, 73.5, 73.5","E Major, G Major, G Major","Verse, Prechorus, Chorus",This game,Konomi Suzuki,"No Game, No Life",,2014,Anime,
000072,75,D# Major,,Daydream Café,Petit Rabbit's,Is the Order a Rabbit?,,2014,Anime,
000073,80,D Major,,Netsuju no Spectrum,Ikimono-gakari,The Seven Deadly Sins,,2014,Anime,
000074,"77.5, 77.5, 77.5","A# Major, C# Major, A# Major","Intro, Verse, Chorus",black bullet,fripSide,Black Bullet,,2014,Anime,
000075,73,G Major,,STEP,ClariS,Nisekoi: False Love,,2014,Anime,
000076,"77.5, 77.5, 77.5","F Major, D Major, F Major","Intro, Verse, Chorus",Nanairo Symphony,Coalamode,Your Lie in April,,2014,Anime,
000077,"75, 75, 75, 75","D# Major, D# Major, F# Major, F# Major","Verse, Chorus, Bridge, Last Chorus",Kanade,Sora Amamiya,One Week Friends,,2014,Anime,
000078,76.5,F Major,,Colorful,Miku Sawai,Saekano: How to Raise a Boring Girlfriend,,2015,Anime,
000079,82,G Major,,Kuchizuke Diamond,WEAVER,Yamada-kun and the Seven Witches,,2015,Anime,
000080,80,C# Major,,Candy Magic,MimimemeMIMI,Yamada-kun and the Seven Witches,,2015,Anime,
000081,77,D Major,,Everyday World,"Saori Hayami, Nao Toyama",My Teen Romantic Comedy SNAFU,,2015,Anime,
000082,"75, 75","F Major, G# Major","Verse, Chorus",Bravely You,Lia,Charlotte,,2015,Anime,
000083,79,E Major,,No Poi!,Petit Rabbit's,Is the Order a Rabbit??,,2015,Anime,
000084,82.5,D Major,, -toward the truth- ,fripSide,Seraph of the End,,2015,Anime,
000085,85.5,G# Major,,Brave Shine,Aimer,Fate/stay night: Unlimited Blade Works,,2015,Anime,
000086,87,D Major,,Harumodoki,nagi yanagi,My Teen Romantic Comedy SNAFU TOO!,,2015,Anime,
000087,70,D# Major,,Akatsuki no Hana,Cyntia,Yona of the Dawn,,2015,Anime,
000088,79.5,D# Major,,Season,Alisa Takigawa,The Seven Deadly Sins,,2015,Anime,
000089,79.5,G Major,,Yasashii Kibou,Saori Hayami,Snow White with the Red Hair,,2015,Anime,
000090,"74, 79","D# Major, D# Major","Intro, Verse",Ring of Fortune,Eri Sasaki,Plastic Memories,,2015,Anime,
000091,83,A# Major,,Miraikei Answer,TRUSTRICK,My Love Story!!,,2015,Anime,
000092,80,D Major,,Hello shooting star,Moumoon,Assassination Classroom,,2015,Anime,
000093,75.5,C Major,,B Chiku Sentai SOX,SOX,Shimoneta: A Boring World Where the Concept of Dirty Jokes Doesn't Exist,,2015,Anime,
000094,85,E Major,,Umarun Taisou,"Aya Suzaki, Yumiri Hanamori, Rumi Ookubo, Haruka Shiraishi",Himouto! Umaru-chan,,2015,Anime,
000095,82,F# Major,,Kimiiro Signal,Luna Haruna,Saekano: How to Raise a Boring Girlfriend,,2015,Anime,
000096,"85, 85","C Major, A Major","Verse, Chorus",Tokimeki Poporon,"Inori Minase, Sora Tokui, Rie Murakawa",Is the Order a Rabbit?,,2015,Anime,
000097,70,G# Major,,Stay Alive,Rie Takahashi,Re:Zero − Starting Life in Another World,,2016,Anime,
000098,82,F# Major,,Koi wo Shita no wa,Aiko,A Silent Voice,,2016,Anime,
000099,75,D Major,,Knew day,(k)NoW_NAME,"Grimgar, Ashes and Illusions",,2016,Anime,
000100,71.5,A# Major,,The Asterisk War,Shiena Nishizawa,The Asterisk War: Season 2,,2016,Anime,
000101,"82.5, 82.5, 82.5","F Major, G Major, F Major","Intro, Verse, Chorus",Daisuki dayo,"Ai Kakuma, Nobuhiko Okamoto",Momokuri,,2016,Anime,
000102,84,F# Major,,99.9,MOB CHOIR feat. sajou no hana,Mob Psycho 100 II,,2016,Anime,
000103,73,G# Major,,Shirushi,LiSA,Sword Art Online: Season 2,,2016,Anime,
000104,79,C Major,,Chiisana Boukensha,"Inori Minase, Sora Amamiya, Rie Takahashi",KONOSUBA: God's blessing on this wonderful world!,,2016,Anime,
000105,85,F# Major,,Great Days,"Karen Aoki, Daisuke Hasegawa",JoJo's Bizarre Adventure: Diamond is Unbreakable,,2016,Anime,
000106,77.5,E Major,,Re: Re:,ASIAN KUNG-FU GENERATION,ERASED: Boku dake ga Inai Machi,,2016,Anime,
000107,71,E Major,,Kaze no Uta,FLOW,Tales of Zestiria the X,,2016,Anime,
000108,85,D Major,,7 -seven-,FLOW x GRANRODEO,The Seven Deadly Sins,,2016,Anime,
000109,70.5,F Major,,LAY YOUR HANDS ON ME,Boom Boom Satellites,Kiznaiver,,2016,Anime,
000110,77,E Major,,Sekai wa Kyou mo Atarashii,Kana Hanazawa,Girls Beyond the Wasteland,,2016,Anime,
000111,70,G Major,,Steppin' Out,FLOW,Durarara!!x2 Ketsu,,2016,Anime,
000112,"70, 70","E Major, F Major","Verse, Chorus",Ima Koko,Nao Touyama,"As The Moon, So Beautiful",,2017,Anime,
000113,74,F# Major,,Akane Sasu,Aimer,Natsume's Book of Friends,,2017,Anime,
000114,"80, 80, 80","A Major, C Major, D# Major","Verse, Chorus, Postchorus",Shinzou wo Sasageyo,Linked Horizon,Attack on Titan: Season 2,,2017,Anime,
000115,"76, 76, 76","F Major, F Major, F# Major","Verse, Chorus, Last Chorus",Bon Appetit S,"Azumi Waki, Akari Kito, Anzu Haruno",Blend S,,2017,Anime,
000116,85,F# Major,,Sen no Tsubasa,livetune adding Takuro Sugawara (from 9mm Parabellum Bullet),Re:Hamatora,,2017,Anime,
000117,85,G Major,,Nimensei☆Uraomote,Aimi Tanaka,Himouto! Umaru-chan: 2nd Season,,2017,Anime,
000118,71,F Major,,Kanashii Ureshii,frederic,Love & Lies,,2017,Anime,
000119,"78, 78, 78","E Major, C# Major, G Major","Intro, Verse, Chorus",Caste Room,ZAQ,Classroom of the Elite,,2017,Anime,
000120,70,G Major,,Hope,Namie Amuro,One Piece,,2017,Anime,
000121,73,F# Major,,DEAREST DROP,Azusa Tadokoro,WorldEnd: What do you do at the end of the world?,,2017,Anime,
000122,84,G Major,,Eien no Labyrinth,Aoi Yuuki,My Girlfriend is ShoBitch,,2017,Anime,
000123,73,F Major,,Tsuki ga Kirei,Nao Touyama,"As The Moon, So Beautiful",,2017,Anime,
000124,82,C Major,,Detarame na Minus to Plus ni Okeru Blend Ko,BLEND-A,Blend S,,2017,Anime,
000125,71,G Major,,Deal with the devil,Tia,Kakegurui,,2017,Anime,
000126,80,C Major,,"Donna Hoshizora Yori mo, Donna Omoide Yori mo",ChouCho,A Sister's All You Need,,2017,Anime,
000127,"82.5, 82.5","D# Major, A# Major","Verse, Chorus",Hitorigoto,ClariS,Eromanga Sensei,,2017,Anime,
000128,71.5,C Major,,Ryuusei,Eir Aoi,Sword Art Online Alternative: Gun Gale Online,,2018,Anime,
000129,72,G# Major,,katharsis,TK from Ling tosite sigure,Tokyo Ghoul:re,,2018,Anime,
000130,84.5,A Major,,Hikari e,FranChouChou,ZOMBIELAND SAGA,,2018,Anime,
000131,85,E Major,,Another colony,TRUE,Kakuriyo: Bed & Breakfast for Spirits,,2018,Anime,
000132,83.5,G Major,,Momoiro Typhoon,Luna Haruna,Yuuna and the Haunted Hot Springs,,2018,Anime,
000133,"86.5, 86.5, 86.5","D Major, F Major, A Major","Verse, Chorus, Bridge",Darling,XX:me,Darling in the FranXX,,2018,Anime,
000134,84,A# Major,,Love Song,Iwami Manaka,Tada Never Falls in Love,,2018,Anime,
000135,"72, 72","D Major, F Major","Verse, Chorus",Sincerely,TRUE,Violet Evergarden,,2018,Anime,
000136,70,C Major,,Itsuka Sekai ga,Iida Riho,Boarding School Juliet,,2018,Anime,
000137,71,F# Major,,POP TEAM EPIC,Sumire Uesaka,Pop Team Epic,,2018,Anime,
000138,"86, 86","D# Major, C Major","Verse, Chorus",Adabana Necromancy,FranChouChou,ZOMBIELAND SAGA,,2018,Anime,
000139,79,D Major,,Otomodachi Film,Masayoshi Oishi,Tada Never Falls in Love,,2018,Anime,
000140,"80, 80, 80","F# Major, A Major, F# Major","Verse, Prechorus, Chorus",SWITCH,Minami,High School DxD Hero,,2018,Anime,
000141,"81, 81, 81","E Major, D Major, E Major","Intro, Verse, Chorus",Korekara,Machico,The Ryuo's Work is Never Done!,,2018,Anime,
000142,87,E Major,,Kimi no Sei,the peggies,Rascal Does Not Dream of Bunny Girl Senpai,,2018,Anime,
000143,74,C Major,,Isekai Quartet,"Satoshi Hino, Jun Fukushima, Yuusuke Kobayashi, Aoi Yuuki",Isekai Quartet,,2019,Anime,
000144,80,F Major,,"Can Now, Can Now",Study,We Never Learn,,2019,Anime,
000145,71,A Major,,Is There Still Anything That Love Can Do,RADWIMPS,Weathering With You,,2019,Anime,
000146,84.5,D Major,,Ringoiro Memories,"Yuuko Goto, Shizuka Ishigami, Sumire Uesaka, Nozomi Yamamoto","Why the Hell are You Here, Teacher!?",,2019,Anime,
000147,75,D# Major,,veil,Keina Suda,Fire Force,,2019,Anime,
000148,86.5,D Major,,TIT FOR TAT,MYTH & ROID,The Hero is Overpowered but Overly Cautious,,2019,Anime,
000149,74,F Major,,forget-me-not,ReoNa,Sword Art Online: Alicization,,2019,Anime,
000150,77,C# Major,,Zero Centimeters,Yuiko Ohara,Teasing Master Takagi-san: Season 2,,2019,Anime,
000151,78,D# Major,,FAITH,MADKID,The Rising of the Shield Hero: Season 2,,2019,Anime,
000152,86,E Major,,Otome domo yo,CHiCO with HoneyWorks,Kaguya-sama: Love is War,,2019,Anime,
000153,77,A Major,,Chime,Ai Otsuka,Fruits Basket (2019),,2019,Anime,
000154,80,F# Major,,HELLO to DREAM,Yuka Iguchi,Is It Wrong to Try to Pick Up Girls in a Dungeon?: Season 2,,2019,Anime,
000155,86.5,C# Major,,Meguru Mono,Takuma Terashima,That Time I Got Reincarnated as a Slime,,2019,Anime,
000156,82.5,D Major,,RISE,MADKID,The Rising of the Shield Hero,,2019,Anime,
000157,73,E Major,,Grand Escape,RADWIMPS,Weathering With You,,2019,Anime,
000158,85,D Major,,Kaen,Ziyoou-vachi,Dororo,,2019,Anime,
000159,"78, 83.5, 83.5","A Major, C Major, A Major","Intro, Verse, Chorus",Sentimental Crisis,halca,Kaguya-sama: Love is War,,2019,Anime,
000160,85,G# Major,,Isekai Girls Talk,"Yumi Hara, Sora Amamiya, Rie Takahashi, Aoi Yuuki",Isekai Quartet,,2019,Anime,
000161,71.5,D Major,,Zettai Zetsumei,Co shu Nie,The Promised Neverland,,2019,Anime,
000162,70,G Major,,Houkago no Liberty,halca,We Never Learn,,2019,Anime,
000163,77,D# Major,,Bon Kyu Bon wa Kare no Mono,Sumire Uesaka,"Why the Hell are you Here, Teacher?! ",,2019,Anime,
000164,"72, 72, 72","E Major, C# Major, E Major","Intro, Verse, Chorus",Little Soldier,Azusa Tadokoro,That Time I Got Reincarnated as a Slime,,2019,Anime,
000165,82,A# Major,,FLARE,Void_Chords feat. LIO,Arifureta: From Commonplace to World's Strongest,,2019,Anime,
000166,"91, 91","C Major, F# Major","Verse, Chorus",Broken Sky,Miyu Tomita,Talentless Nana,Fall,2020,Anime,
000167,123,B Major,,Shinkai,Eve,"Josee, the Tiger and the Fish",Fall,2020,Anime,
000168,90,A Major,,SPARK-AGAIN,Aimer,Fire Force: Season 2,Summer,2020,Anime,
000169,134,E Major,,Star Marker,KANA-BOON,My Hero Academia: Season 4,Winter,2020,Anime,
000170,80,D Major,,Tomoshibi no Manimani,Nao Toyama,Kakuriyo: Bed & Breakfast for Spirits,Spring,2018,Anime,
000171,"122, 122","C# Major, C Major","Verse, Chorus",LOST IN PARADISE,ALI,Jujutsu Kaisen,Fall,2020,Anime,
000172,"92.5, 92.5","C Major, G Major","Verse, Chorus",Kokuhaku Bungee Jump,halca,Rent-a-Girlfriend,Summer,2020,Anime,
000173,"76, 76","E Major, F# Major","Verse, Chorus",Kyuukyoku Unbalance,Afilia Saga,"BOFURI: I Don't Want to Get Hurt, so I'll Max Out My Defense.",Winter,2020,Anime,
000174,138,E Major,,FIRST DROP,halca,Rent-a-Girlfriend,Summer,2020,Anime,
000175,"80, 80, 80","A# Major, C Major, A# Major","Intro, Verse, Chorus",WAKE UP HxEROS,"BURNOUT SYNDROMES, Yoshitsugu Matsuoka",SUPER HXEROS,Summer,2020,Anime,
000176,"95, 95","D# Major, C Major","Verse, Chorus",Torch of Liberty,KANA-BOON,Fire Force: Season 2,Summer,2020,Anime,
000177,82,F Major,,Plunderer,Miku Itou,Plunderer,Winter,2020,Anime,
000178,95,E Major,,Desire,PELICAN FANCLUB,Fire Force: Season 2,Summer,2020,Anime,
000179,124,C# Major,,BREAKING DAWN,Jae Joong,Noblesse,Fall,2020,Anime,
000180,91,F# Major,,Megumi no Ame,nagi yanagi,My Teen Romantic Comedy SNAFU Climax!,Summer,2020,Anime,
000181,"85, 85","C Major, G Major","Verse, Chorus",Tiny Light,Akari Kito,Toilet-Bound Hanako-kun,Winter,2020,Anime,
000182,96,D Major,,A Walk,Gakuto Kajiwara,Black Clover,Summer,2020,Anime,
000183,"76, 76, 76, 76","D Major, E Major, E Major, G Major","Verse, Chorus, Bridge, Chorus 2",homura,LiSA,Demon Slayer: Kimetsu no Yaiba: The Movie: Mugen Train,Fall,2020,Anime,
000184,88,E Major,,Crossing Road,Mai Fuchigami,Food Wars! The Fifth Plate,Spring,2020,Anime,
000185,87,D# Major,,Isekai Showtime,Isekai Quartet,Isekai Quartet 2,Winter,2020,Anime,
000186,"88, 88, 88, 88, 88","C# Major, E Major, E Major, G# Major, G# Major","Intro, Verse, Prechorus A, Prechorus B, Chorus",Kimi To Iu Shinhwa,"Jun Maeda, nagi yanagi",The Day I Became a God,Fall,2020,Anime,
000187,84,D# Major,,Kaze Fukeba Tsukiyo no Hate ni,AOP,Tsugu Tsugumomo,Spring,2020,Anime,
000188,81,D Major,,Kago no Naka ni Tori,yourness,"Sing ""Yesterday"" for Me",Spring,2020,Anime,
000189,70,D Major,,Centimeter,the peggies,Rent-a-Girlfriend,Summer,2020,Anime,
000190,73.5,F Major,,Ready To,Sumire Morohoshi,BNA: Brand New Animal,Spring,2020,Anime,
000191,87.5,D# Major,,NEW ERA,SixTONES,Yashahime: Princess Half-Demon,Fall,2020,Anime,
000192,"124, 124, 124, 124","F# Major, F# Major, F Major, F# Major","Intro, Verse, Chorus, Bridge",Nakayoshi! ○! Nakayoshi!,Chimame-tai,Is the Order a Rabbit? Bloom,Fall,2020,Anime,
000193,129,A Major,,Kimi ni Aeta Hi,"Akari Kito, Miku Ito",Adachi and Shimamura,Fall,2020,Anime,
000194,80,A Major,,Diamond Clarity,"Saori Hayami, Nao Toyama",My Teen Romantic Comedy SNAFU Climax!,Summer,2020,Anime,
000195,83,G# Major,,PARADOX,Sora Amamiya,"Science Fell in Love, So I Tried to Prove It",Winter,2020,Anime,
000196,85,D# Major,,DREAMIN' ON,Da-iCE,One Piece,Winter,2020,Anime,
000197,75,D Major,,Magic Words,Liyuu,Hatena Illusion,Winter,2020,Anime,
000198,"97.5, 97.5, 97.5","D# Major, D# Major, E Major","Verse, Chorus, Last Chorus",Hero Too,Chrissy Costanza,My Hero Academia: Season 4,Winter,2020,Anime,
000199,73,E Major,,Against.,Kaori Ishihara,Our Last Crusade or the Rise of a New World,Fall,2020,Anime,
000200,77,B Major,,Tenkuu Cafeteria,Petit Rabbit's,Is the Order a Rabbit? Bloom,Fall,2020,Anime,
000201,92.5,A# Major,,Kaikai Kitan,Eve,Kaikai Kitan,Fall,2020,Anime,
000202,138,B Major,,DADDY! DADDY! DO!,"Masayuki Suzuki, Airi Suzuki",Kaguya-sama: Love is War: Season 2,Spring,2020,Anime,
000203,125,C Major,,Memento,nonoc,Re:ZERO: Starting Life in Another World: Season 2,Summer,2020,Anime,
000204,90,G Major,,Nijiiro Passions!,Nijigasaki School Idol Club,Love Live! Nijigasaki High School Idol Club,Fall,2020,Anime,
000205,80,A Major,,SLUMP,Stray Kids,Tower of God,Spring,2020,Anime,
000206,71,G Major,,Turing Love,"Akari Nanawo, Sou","Science Fell in Love, So I Tried to Prove It",Winter,2020,Anime,
000207,70.5,F# Major,,Let’s Go To Paradise,"Yuusuke Kobayashi, Junji Majima, Miyu Tomita",Interspecies Reviewers,Winter,2020,Anime,
000208,"125, 125, 125","D Major, D Major, B Major","Verse, Chorus, Bridge",ID,CIDERGIRL,Fire Force: Season 2,Summer,2020,Anime,
000209,97.5,C# Major,,Tsuki to Hoshizora,"Yunomi, Tsukasa Yuzuki",Tonikaku Kawaii,Fall,2020,Anime,
000210,"88, 88","E Major, G Major","Verse, Chorus",I will…,Eir Aoi,Sword Art Online: Alicization: War of Underworld: Part 2,Summer,2020,Anime,
000211,110,G# Major,,Anti world,Kanako Takatsuki,I'm Standing on a Million Lives,Fall,2020,Anime,
000212,"101.5, 101.5, 101.5","E Major, G Major, E Major","Verse, Prechorus, Chorus",DiViNE,EXiNA,Blue Reflection Ray,Spring,2021,Anime,
000213,130,G Major,,Onnaji Kimochi.,Kiyono Yasuno,Restaurant to Another World 2,Fall,2021,Anime,
000214,89,C Major,,Wanna Fly?,Yoko Ishida,World Witches Take Off!,Winter,2021,Anime,
000215,"138, 138, 138, 138","A# Major, G Major, C Major, D# Major","Intro, Verse, Chorus, Bridge",Jinsei Easy?,DIALOGUE+,Bottom-Tier Character Tomozaki,Winter,2021,Anime,
000216,87.5,A# Major,,Like Flames,MindaRyn,That Time I Got Reincarnated as a Slime: Season 2: Part 2,Summer,2021,Anime,
000217,100,C# Major,,give it back,Co shu Nie,Jujutsu Kaisen,Winter,2021,Anime,
000218,93.5,D Major,,Kyoukaisen,amazarashi,86 Part 2,Fall,2021,Anime,
000219,72,D Major,,SHAKE! SHAKE! SHAKE!,Yuuma Uchida,Dr. Ramune: Mysterious Disease Specialist,Winter,2021,Anime,
000220,"90, 90, 90","E Major, E Major, F Major","Verse, Chorus, Last Chorus",Yuke,LiSA,Sword Art Online the Movie: Progressive: Aria of a Starless Night,,2021,Anime,
000221,91,C# Major,,Kokoro Hayaru,Akane Kumada,Drug Store in Another World: The Slow Life of a Cheat Pharmacist,Summer,2021,Anime,
000222,90,C# Major,,Only one yell,9-tie,Selection Project,Fall,2021,Anime,
000223,90,F Major,,ODDTAXI,"PUNPEE, Skirt",Odd Taxi,Spring,2021,Anime,
000224,70,F Major,,Shirushibi,nagi yanagi,The Faraway Paladin,Fall,2021,Anime,
000225,85,D# Major,,Otogibanashi no Youna Kiseki,Aoi Kubo,Deiji Meets Girl,Fall,2021,Anime,
000226,"93, 93, 93, 93, 93","B Major, B Major, G Major, A Major, A Major","Verse, Prechorus A, Prechorus B, Chorus, Bridge",Zankoku na Yume to Nemure,Minami Kuribayashi,Redo of Healer,Winter,2021,Anime,
000227,136,D Major,,freeze,flumpool,Seven Knights Revolution: Hero Successor,Spring,2021,Anime,
000228,100,D# Major,,Mahi,yama,2.43: Seiin High School Boys Volleyball Team,Winter,2021,Anime,
000229,93,G Major,,Rinne,V.W.P,Muv-Luv Alternative,Fall,2021,Anime,
000230,"120.67, 120.67","B Major,  C Major","Verse, Chorus",takt,Mafumafu,takt op.Destiny,Fall,2021,Anime,
000231,128,G# Major,,Grandeur,Snow Man,Black Clover,Winter,2021,Anime,
000232,"87.5, 87.5, 87.5","A Major, G Major, F# Major","Verse, Prechorus, Chorus",Susume! Mujina Company,"Hisako Kanemoto, Rina Hidaka, Sumire Uesaka",Cute Executive Officer,Winter,2021,Anime,
000233,89,C Major,,STACKiNG,BiSH,Kingdom: Season 3,Fall,2021,Anime,
000234,75,C Major,,Only,Yuiko Ohara,Mushoku Tensei: Jobless Reincarnation,Winter,2021,Anime,
000235,90,A Major,,Colorful Canvas,"Aina Suzuki, Mikako Komatsu, Shiori Izawa, Sumire Uesaka","Don't Toy With Me, Miss Nagatoro",Summer,2021,Anime,
000236,93,G Major,,Shounen Shoujo,Ging Nang Boyz,Sonny Boy,Summer,2021,Anime,
000237,120,G Major,,Toumei na Sekai,Little Glee Monster,Yashahime: Princess Half-Demon: The Second Act,Fall,2021,Anime,
000238,91,F# Major,,Hoshi no Orchestra,saji,"The Curtain Rises, Opera Girl!",Summer,2021,Anime,
000239,130,A# Major,,in case…,BiSH,Godzilla Singular Point,Spring,2021,Anime,
000240,82,G Major,,Tomedonai Shiosai,ARCANA PROJECT,The Aquatope on White Sand,Fall,2021,Anime,
000241,72,G Major,,Bouken no VLOG,CHiCO with HoneyWorks,Edens Zero,Spring,2021,Anime,
000242,132,G Major,,Wadachi,SPYAIR,Gintama: The Final Movie,Winter,2021,Anime,
000243,75,F Major,,Fuzaketenaize,Necry Talkie,"Girlfriend, Girlfriend",Summer,2021,Anime,
000244,124,G Major,,TWISTED HEARTS,Tasuku Hatanaka,Moriarty the Patriot Part 2,Spring,2021,Anime,
000245,86,C# Major,,Pleasure,WARPs UP,Fruits Basket (2019): The Final,Spring,2021,Anime,
000246,97.5,D# Major,,Eden through the rough,Takanori Nishikawa,Edens Zero,Spring,2021,Anime,
000247,100,D Major,,Rise Again,AIRFLIP,Ex-Arm,Winter,2021,Anime,
000248,"135, 135, 135","B Major, B Major, D Major","Verse, Chorus, Bridge",EVERBLUE,Omoinotake,Blue Period,Fall,2021,Anime,
000249,72.5,C Major,,Shirushi,Sayaka Sasaki,Kemono Jihen,Winter,2021,Anime,
000250,121,A Major,,Mahou no Kaze,Akane Kumada,Super Cub,Spring,2021,Anime,
000251,"70, 70, 70","F Major, D# Major, F Major","Intro, Verse, Chorus",101,Sangatsu no Phantasia,The Honor Student at Magic High School,Summer,2021,Anime,
000252,"100, 136, 136","C# Major, C# Major, F# Major","Intro, Verse, Chorus",Zankoku Shangri-La,OZ,Visual Prison,Fall,2021,Anime,
000253,88,C# Major,,Mahou,Caho,"Dad is a Hero, Mom is a Spirit, I'm a Reincarnator",Winter,2021,Anime,
000254,"110, 110","F Major, A Major","Verse, Chorus",gudafuwa everyday,Aoi Yuuki,I've Been Killing Slimes for 300 Years and Maxed Out My Level,Spring,2021,Anime,
000255,132,D Major,,Role-Playing,Masayoshi Oishi,Dragon Goes House-Hunting,Spring,2021,Anime,
000256,"79, 79","D Major, E Major","Verse, Chorus",Bloodlines ~Unmei no Kettou~,JAM PROJECT,Getter Robo Arc,Spring,2021,Anime,
000257,92,B Major,,Ginsekai,BURNOUT SYNDROMES,Those Snow White Notes,Spring,2021,Anime,
